{
  "$schema": "../schemas/verification-entry.schema.json",
  "schemaVersion": "1.0.0",
  "registry": "ny_dol",
  "rawSnapshot": "raw/nydol-hder-iq9y-2026-08-15.json",
  "organizationId": "wilhelmina",
  "agencyId": null,
  "legalName": "WILHELMINA INTERNATIONAL INC.",
  "dba": null,
  "certificateNumber": "26-69UG6-LSFW",
  "registeredOn": "2026-07-29",
  "expiresOn": "2028-07-29",
  "registryStatus": "active",
  "officialSiteUrl": null,
  "officialApplyUrl": "https://www.wilhelmina.com/become-a-model",
  "evidenceUrl": "https://data.ny.gov/resource/hder-iq9y.json",
  "retrievedOn": "2026-08-15",
  "verifiedOn": "2026-08-15",
  "notes": null
}
