{
  "$schema": "../schemas/verification-entry.schema.json",
  "schemaVersion": "1.0.0",
  "registry": "ny_dol",
  "rawSnapshot": "raw/nydol-hder-iq9y-2026-08-15.json",
  "organizationId": "ford-models",
  "agencyId": null,
  "legalName": "Ford Models, Inc.",
  "dba": "Ford Models",
  "certificateNumber": "26-69V5K-LSFW",
  "registeredOn": "2026-07-01",
  "expiresOn": "2028-07-01",
  "registryStatus": "active",
  "officialSiteUrl": null,
  "officialApplyUrl": "https://agency.getsnapcast.com/registrants/new_ford",
  "evidenceUrl": "https://data.ny.gov/resource/hder-iq9y.json",
  "retrievedOn": "2026-08-15",
  "verifiedOn": "2026-08-15",
  "notes": null
}
