{
  "$schema": "../schemas/verification-entry.schema.json",
  "schemaVersion": "1.0.0",
  "registry": "ny_dol",
  "rawSnapshot": "raw/nydol-hder-iq9y-2026-08-15.json",
  "organizationId": "elite-model-management",
  "agencyId": null,
  "legalName": "ELITE MODEL MANAGEMENT, LLC",
  "dba": null,
  "certificateNumber": "26-69YIX-LSFW",
  "registeredOn": "2026-05-28",
  "expiresOn": "2028-05-28",
  "registryStatus": "active",
  "officialSiteUrl": null,
  "officialApplyUrl": "https://elitemodelmanagement.com/get-scouted.web",
  "evidenceUrl": "https://data.ny.gov/resource/hder-iq9y.json",
  "retrievedOn": "2026-08-15",
  "verifiedOn": "2026-08-15",
  "notes": null
}
