{
  "$schema": "../schemas/verification-entry.schema.json",
  "schemaVersion": "1.0.0",
  "registry": "ny_dol",
  "rawSnapshot": "raw/nydol-hder-iq9y-2026-08-15.json",
  "organizationId": "the-society-management",
  "agencyId": "fe9a146a-2301-41b4-9a2e-3383034180ac",
  "legalName": "SCTY Management, LLC",
  "dba": "The Society",
  "certificateNumber": "26-67ARR-LSFW",
  "registeredOn": "2026-01-12",
  "expiresOn": "2028-01-12",
  "registryStatus": "active",
  "officialSiteUrl": null,
  "officialApplyUrl": "https://www.thesocietymanagement.com/become-model.web",
  "evidenceUrl": "https://data.ny.gov/resource/hder-iq9y.json",
  "retrievedOn": "2026-08-15",
  "verifiedOn": "2026-08-15",
  "notes": null
}
