{
  "$schema": "../schemas/verification-entry.schema.json",
  "schemaVersion": "1.0.0",
  "registry": "ny_dol",
  "rawSnapshot": "raw/nydol-hder-iq9y-2026-08-15.json",
  "organizationId": "muse-model-management",
  "agencyId": null,
  "legalName": "Muse Management, Inc.",
  "dba": null,
  "certificateNumber": "26-67AN4-LSFW",
  "registeredOn": "2026-01-12",
  "expiresOn": "2028-01-12",
  "registryStatus": "active",
  "officialSiteUrl": null,
  "officialApplyUrl": "https://www.musenyc.com/contact",
  "evidenceUrl": "https://data.ny.gov/resource/hder-iq9y.json",
  "retrievedOn": "2026-08-15",
  "verifiedOn": "2026-08-15",
  "notes": null
}
