{
  "$schema": "../schemas/verification-entry.schema.json",
  "schemaVersion": "1.0.0",
  "registry": "ny_dol",
  "rawSnapshot": "raw/nydol-hder-iq9y-2026-08-15.json",
  "organizationId": "one-management",
  "agencyId": null,
  "legalName": "1 Model Management, LLC",
  "dba": "ONE Management",
  "certificateNumber": "26-69U8B-LSFW",
  "registeredOn": "2026-07-29",
  "expiresOn": "2028-07-29",
  "registryStatus": "active",
  "officialSiteUrl": null,
  "officialApplyUrl": "https://onemanagement.com/submissions/application",
  "evidenceUrl": "https://data.ny.gov/resource/hder-iq9y.json",
  "retrievedOn": "2026-08-15",
  "verifiedOn": "2026-08-29",
  "notes": null
}
