{
  "$schema": "../schemas/verification-entry.schema.json",
  "schemaVersion": "1.0.0",
  "registry": "ny_dol",
  "rawSnapshot": "raw/nydol-hder-iq9y-2026-08-15.json",
  "organizationId": "curv-management",
  "agencyId": null,
  "legalName": "CURV Model Mangement",
  "dba": null,
  "certificateNumber": "26-69SRC-LSFW",
  "registeredOn": "2026-08-07",
  "expiresOn": "2028-08-07",
  "registryStatus": "active",
  "officialSiteUrl": null,
  "officialApplyUrl": "https://thecurvmanagement.com/submissions",
  "evidenceUrl": "https://data.ny.gov/resource/hder-iq9y.json",
  "retrievedOn": "2026-08-15",
  "verifiedOn": "2026-08-29",
  "notes": null
}
