{
  "$schema": "../schemas/verification-entry.schema.json",
  "schemaVersion": "1.0.0",
  "registry": "ny_dol",
  "rawSnapshot": "raw/nydol-hder-iq9y-2026-08-15.json",
  "organizationId": "q-management",
  "agencyId": null,
  "legalName": "Que Management Inc",
  "dba": null,
  "certificateNumber": "26-6771P-LSFW",
  "registeredOn": "2026-01-29",
  "expiresOn": "2028-01-29",
  "registryStatus": "active",
  "officialSiteUrl": null,
  "officialApplyUrl": "https://www.qmanagementinc.com/join",
  "evidenceUrl": "https://data.ny.gov/resource/hder-iq9y.json",
  "retrievedOn": "2026-08-15",
  "verifiedOn": "2026-08-29",
  "notes": null
}
