{
  "$schema": "../schemas/verification-entry.schema.json",
  "schemaVersion": "1.0.0",
  "registry": "ny_dol",
  "rawSnapshot": "raw/nydol-hder-iq9y-2026-08-15.json",
  "organizationId": "bicoastal-management",
  "agencyId": null,
  "legalName": "Maliwawa Productions Inc.",
  "dba": "Bicoastal Mgmt",
  "certificateNumber": "26-675G6-LSFW",
  "registeredOn": "2026-01-21",
  "expiresOn": "2028-01-21",
  "registryStatus": "active",
  "officialSiteUrl": null,
  "officialApplyUrl": "https://www.bicoastalmgmt.com/get-scouted",
  "evidenceUrl": "https://data.ny.gov/resource/hder-iq9y.json",
  "retrievedOn": "2026-08-15",
  "verifiedOn": "2026-08-29",
  "notes": null
}
